<?xml version="1.0" encoding="UTF-8"?>
<questions xmlns:xsi="http://www.w3.org/2001/XMLSchema-instance"
           xsi:noNamespaceSchemaLocation="questions.xsd">

  <question id="1">
    <text>Hey there ğŸ‘‹! First things firstâ€”what brings you to Germany?</text>
    <tooltip>
      welcome-tooltip
    </tooltip>
    <options>
      <option id="1">ğŸ“ Studying</option>
      <option id="2">ğŸ’¼ Working</option>
      <option id="3">ğŸ‘¨â€ğŸ‘©â€ğŸ‘§ Family reunion</option>
      <option id="4">ğŸŒ Just exploring options</option>
    </options>
    <nextQuestions>
      <next optionId="1" questionId="2"/>
      <next optionId="2" questionId="2"/>
      <next optionId="3" questionId="3"/>
      <next optionId="4" questionId="3"/>
    </nextQuestions>
  </question>

  <question id="2">
    <text>Awesome! Do you have a confirmed acceptance letter or job offer already?</text>
    <options>
      <option id="1">âœ… Yes, ready to roll!</option>
      <option id="2">â³ Nope, still waiting</option>
      <option id="3">ğŸ¤·â€â™‚ï¸ Not yet, still searching</option>
    </options>
    <nextQuestions>
      <next optionId="1" questionId="4"/>
      <next optionId="2" questionId="3"/>
      <next optionId="3" questionId="7"/>
    </nextQuestions>
  </question>

  <question id="3">
    <text>Let&apos;s talk languages! ğŸ‡©ğŸ‡ª What&apos;s your current level of German?</text>
    <tooltip>
      Knowing German opens many doors, but no worries if you&apos;re still learning!
    </tooltip>
    <options>
      <option id="1">ğŸ–ï¸ Fluent or advanced</option>
      <option id="2">ğŸ“˜ Intermediate (B1-B2)</option>
      <option id="3">ğŸ“— Beginner (A1-A2)</option>
      <option id="4">ğŸš« I don&apos;t speak German</option>
    </options>
    <nextQuestions>
      <next optionId="1" questionId="4"/>
      <next optionId="2" questionId="4"/>
      <next optionId="3" questionId="4"/>
      <next optionId="4" questionId="4"/>
    </nextQuestions>
  </question>

  <question id="4">
    <text>Have you ever visited Germany or the Schengen area before?</text>
    <tooltip>
      The Schengen area includes all EU countries except Ireland.It also includes Norway, Iceland, Switzerland, and Liechtenstein.
    </tooltip>
    <options>
      <option id="1">âœˆï¸ Yes, for less than 6 months!</option>
      <option id="2">ğŸ›« Yes, for more than 6 months!</option>
      <option id="3">âŒ No, first time!</option>
    </options>
    <nextQuestions>
      <next optionId="1" questionId="5"/>
      <next optionId="2" questionId="5"/>
      <next optionId="3" questionId="5"/>
    </nextQuestions>
  </question>

  <question id="5">
    <text>Do you plan to live in a city ğŸ™ï¸ or countryside ğŸŒ³?</text>
    <options>
      <option id="1">ğŸ™ï¸ Definitely city!</option>
      <option id="2">ğŸŒ³ Countryside, please!</option>
      <option id="3">ğŸ¤” Not sure yet</option>
    </options>
    <nextQuestions>
      <next optionId="1" questionId="6"/>
      <next optionId="2" questionId="6"/>
      <next optionId="3" questionId="6"/>
    </nextQuestions>
  </question>

  <question id="6">
    <text>Are you bringing your family or pets along ğŸ¶ğŸ±?</text>
    <options>
      <option id="1">ğŸ‘¨â€ğŸ‘©â€ğŸ‘§â€ğŸ‘¦ Family</option>
      <option id="2">ğŸ¾ Pets</option>
      <option id="3">ğŸš¶ Just me!</option>
    </options>
  </question>

  <question id="7">
    <text>What kind of support are you looking for in your job search?</text>
    <options>
      <option id="1">Resume/CV review</option>
      <option id="2">Interview preparation</option>
      <option id="3">Job portal recommendations</option>
      <option id="4">General guidance</option>
    </options>
    <nextQuestions>
      <next optionId="1" questionId="3"/>
      <next optionId="2" questionId="3"/>
      <next optionId="3" questionId="3"/>
      <next optionId="4" questionId="3"/>
    </nextQuestions>
  </question>

  <dependencies>
    <document type="mandatory">
      <text>ğŸ“˜ Valid Passport</text>
      <conditions>
        <condition questionId="4" optionId="2"/>
      </conditions>
    </document>

    <document type="mandatory">
      <text>University Acceptance Letter</text>
      <conditions>
        <condition questionId="1" optionId="1"/>
        <condition questionId="2" optionId="1"/>
      </conditions>
    </document>

    <document type="mandatory">
      <text>Employment Contract</text>
      <conditions>
        <condition questionId="1" optionId="2"/>
        <condition questionId="2" optionId="1"/>
      </conditions>
    </document>

    <document type="optional">
      <text>Proof of Financial Means</text>
      <conditions>
        <condition questionId="1" optionId="1"/>
        <condition questionId="1" optionId="2"/>
        <condition questionId="1" optionId="4"/>
      </conditions>
    </document>

    <document type="optional">
      <text>Travel History Records</text>
      <conditions>
        <condition questionId="4" optionId="1"/>
      </conditions>
    </document>

  </dependencies>

</questions>